<?xml version="1.0" encoding="ISO-8859-1" ?>
<!DOCTYPE tobago-config PUBLIC
    "-//Atanion GmbH//DTD Tobago Config 1.0//EN" "tobago-config_1_0.dtd">

<tobago-config>

  <theme-config>
    <default-theme>com.atanion.tobago.context.SpeysideTheme</default-theme>
    <supported-theme>com.atanion.tobago.context.ScarboroughTheme</supported-theme>
<!--    <supported-theme>com.atanion.tobago.context.TuiTheme</supported-theme>-->
    <supported-theme>com.atanion.tobago.context.InexsoTheme</supported-theme>
    <supported-theme>com.atanion.tobago.context.SapTheme</supported-theme>
<!--    <supported-theme>com.atanion.tobago.context.CharlottevilleTheme</supported-theme>-->
  </theme-config>

  <resource-dir>tobago-app</resource-dir>
  <resource-dir>tobago</resource-dir>

  <mapping-rule>
    <request-uri>/welcome.view</request-uri>
    <forward-uri>/demo.jsp</forward-uri>
    <attribute>
      <key>demoContent</key>
      <value>snip/welcome.jsp</value>
    </attribute>
  </mapping-rule>

  <mapping-rule>
    <request-uri>/text.view</request-uri>
    <forward-uri>/demo.jsp</forward-uri>
    <attribute>
      <key>demoContent</key>
      <value>snip/text.jsp</value>
    </attribute>
  </mapping-rule>

  <mapping-rule>
    <request-uri>/link.view</request-uri>
    <forward-uri>/demo.jsp</forward-uri>
    <attribute>
      <key>demoContent</key>
      <value>snip/link.jsp</value>
    </attribute>
  </mapping-rule>

  <mapping-rule>
    <request-uri>/checkbox.view</request-uri>
    <forward-uri>/demo.jsp</forward-uri>
    <attribute>
      <key>demoContent</key>
      <value>snip/checkbox.jsp</value>
    </attribute>
  </mapping-rule>

  <mapping-rule>
    <request-uri>/select.view</request-uri>
    <forward-uri>/demo.jsp</forward-uri>
    <attribute>
      <key>demoContent</key>
      <value>snip/select.jsp</value>
    </attribute>
  </mapping-rule>

  <mapping-rule>
    <request-uri>/sheet.view</request-uri>
    <forward-uri>/demo.jsp</forward-uri>
    <attribute>
      <key>demoContent</key>
      <value>snip/sheet.jsp</value>
    </attribute>
  </mapping-rule>

  <mapping-rule>
    <request-uri>/layout.view</request-uri>
    <forward-uri>/demo.jsp</forward-uri>
    <attribute>
      <key>demoContent</key>
      <value>snip/layout.jsp</value>
    </attribute>
  </mapping-rule>

  <mapping-rule>
    <request-uri>/tab.view</request-uri>
    <forward-uri>/demo.jsp</forward-uri>
    <attribute>
      <key>demoContent</key>
      <value>snip/tab.jsp</value>
    </attribute>
  </mapping-rule>

  <mapping-rule>
    <request-uri>/utils.view</request-uri>
    <forward-uri>/demo.jsp</forward-uri>
    <attribute>
      <key>demoContent</key>
      <value>snip/utils.jsp</value>
    </attribute>
  </mapping-rule>

  <mapping-rule>
    <request-uri>/object.view</request-uri>
    <forward-uri>/demo.jsp</forward-uri>
    <attribute>
      <key>demoContent</key>
      <value>snip/object.jsp</value>
    </attribute>
  </mapping-rule>

  <mapping-rule>
    <request-uri>/file.view</request-uri>
    <forward-uri>/demo.jsp</forward-uri>
    <attribute>
      <key>demoContent</key>
      <value>snip/fileUpload.jsp</value>
    </attribute>
  </mapping-rule>

  <mapping-rule>
    <request-uri>/fileShow.view</request-uri>
    <forward-uri>/demo.jsp</forward-uri>
    <attribute>
      <key>demoContent</key>
      <value>snip/fileShow.jsp</value>
    </attribute>
  </mapping-rule>

  <mapping-rule>
    <request-uri>/toolbar.view</request-uri>
    <forward-uri>/demo.jsp</forward-uri>
    <attribute>
      <key>demoContent</key>
      <value>snip/toolbar.jsp</value>
    </attribute>
  </mapping-rule>

  <mapping-rule>
    <request-uri>/tree.view</request-uri>
    <forward-uri>/demo.jsp</forward-uri>
    <attribute>
      <key>demoContent</key>
      <value>snip/tree.jsp</value>
    </attribute>
  </mapping-rule>

  <mapping-rule>
    <request-uri>/treeListbox.view</request-uri>
    <forward-uri>/demo.jsp</forward-uri>
    <attribute>
      <key>demoContent</key>
      <value>snip/treeListbox.jsp</value>
    </attribute>
  </mapping-rule>

  <mapping-rule>
    <request-uri>/validation.view</request-uri>
    <forward-uri>/demo.jsp</forward-uri>
    <attribute>
      <key>demoContent</key>
      <value>snip/validation.jsp</value>
    </attribute>
  </mapping-rule>

  <mapping-rule>
    <request-uri>/editor.view</request-uri>
    <forward-uri>/demo.jsp</forward-uri>
    <attribute>
      <key>demoContent</key>
      <value>snip/editor.jsp</value>
    </attribute>
  </mapping-rule>

  <mapping-rule>
    <request-uri>/builder/index.view</request-uri>
    <forward-uri>/demo.jsp</forward-uri>
    <attribute>
      <key>demoContent</key>
      <value>builder/index.jsp</value>
    </attribute>
  </mapping-rule>

  <mapping-rule>
    <request-uri>/builder/enterPagename.view</request-uri>
    <forward-uri>/demo.jsp</forward-uri>
    <attribute>
      <key>demoContent</key>
      <value>builder/enterPagename.jsp</value>
    </attribute>
  </mapping-rule>

  <mapping-rule>
    <request-uri>/builder/viewSource.view</request-uri>
    <forward-uri>/demo.jsp</forward-uri>
    <attribute>
      <key>demoContent</key>
      <value>builder/viewSource.jsp</value>
    </attribute>
  </mapping-rule>

  <mapping-rule>
    <request-uri>/quiz.view</request-uri>
    <forward-uri>/demo.jsp</forward-uri>
    <attribute>
      <key>demoContent</key>
      <value>snip/quiz.jsp</value>
    </attribute>
  </mapping-rule>

  <mapping-rule>
    <request-uri>/tutorial.view</request-uri>
    <forward-uri>/demo.jsp</forward-uri>
    <attribute>
      <key>demoContent</key>
      <value>tutorial-folder/tutorial.jsp</value>
    </attribute>
  </mapping-rule>

  <mapping-rule>
    <request-uri>/banking.view</request-uri>
    <forward-uri>/demo.jsp</forward-uri>
    <attribute>
      <key>demoContent</key>
      <value>banking-folder/banking.jsp</value>
    </attribute>
  </mapping-rule>

  <mapping-rule>
    <request-uri>/screenshot.view</request-uri>
    <forward-uri>screenshot/screenshot.jsp</forward-uri>
    <attribute>
      <key>sceenshotContent</key>
      <value>screenshot/screenshot.jsp</value>
    </attribute>
  </mapping-rule>

</tobago-config>
